{
  "status": "completed",
  "summary": "Profiled startup and isolated the dominant bundle cost.",
  "result_path": ".xiaotao/tasks/example/workers/frontend-performance/runs/result.md",
  "worker_state_path": ".xiaotao/tasks/example/workers/frontend-performance/current-state.md",
  "needs_user_input": false,
  "questions": [],
  "recommended_next": [
    {
      "capabilities": ["architecture-design", "runtime-analysis"],
      "reason": "Evaluate the boundary around the dominant module"
    }
  ]
}
