{
  "status": "completed",
  "summary": "Validated a completed result.",
  "result_path": "xiaotao/references/scenarios/validator-fixtures/files/result.md",
  "worker_state_path": "xiaotao/references/scenarios/validator-fixtures/files/current-state.md",
  "needs_user_input": false,
  "questions": [],
  "recommended_next": []
}
